{
    "full_name": {
      "primary_response": "Tanawitch Saentree",
      "extra_notes": [
        "You can call me Nate for short!",
        "I know it's a bit of a mouthful, it's a Thai name!",
        "It's pronounced Tah-nah-witch Sai-tree."
      ]
    },
    "current_role": "Lead Product Designer",
    "career_outlook": "I'm open for any role that is meaningful and can make an impact.",
    "work_experience": [
      {
        "company": "Invitrace",
        "role": "Lead Product Designer",
        "start_date": "November 2022",
        "end_date": "Current",
        "description": "As Lead Product Designer at Invitrace Health, I believe our solutions bring real value to healthcare. I manage a team of designers, build scalable design systems, explore new technologies, and shape user flows to create seamless experiences. I‚Äôm passionate about mentoring my team and driving meaningful impact through thoughtful design.",
        "link": "https://www.invitracehealth.com/"
      },
      {
        "company": "CP Origin",
        "role": "Senior Product Designer",
        "start_date": "June 2021",
        "end_date": "October 2022",
        "description": "Collaborated with multiple teams from start to finish, conducting research to create a seamless experience. Designed information architecture by conducting card sorting with users. Utilized user information to create wireframes and conduct testing with the target user personas. Defined a style guide, components, and colors to ensure consistency across both the mobile app and web app.",
        "link": "https://www.cp-origin.com/"
      },
      {
        "company": "DoctorAnywhere",
        "role": "Senior UX/UI Designer",
        "start_date": "January 2021",
        "end_date": "May 2021",
        "summary": "Worked on a small project to rapidly ship a COVID vaccine passport.",
        "description": "As a Senior UX/UI Designer at Doctor Anywhere, I was involved in a fast-paced project to design and ship a COVID vaccine passport. The focus was on rapid development and deployment to meet urgent public health needs.",
        "link": "https://www.doctoranywhere.co.th/"
      },
      {
        "company": "Codefin",
        "role": "Senior Designer",
        "start_date": "August 2020",
        "end_date": "December 2020",
        "summary": "Designed an award-winning mutual fund application for a finance company.",
        "description": "As a Senior Designer at Codefin, a finance company, I was contracted to build a mutual fund application. This project was recognized for its excellence, receiving an award for customer experience in Asia.",
        "achievements": ["Awarded for customer experience in Asia for the mutual fund application."],
        "link": "https://codefin.io/"
      },
      {
        "company": "Peakaccount",
        "role": "UX/UI Designer",
        "start_date": "November 2018",
        "end_date": "July 2020",
        "summary": "Entered the real world of UX/UI design in the financial sector.",
        "description": "At Peakaccount, I began my journey as a UX/UI Designer, gaining hands-on experience in the financial industry. This role provided foundational knowledge and practical skills in designing user experiences and interfaces within a real-world business context.",
        "link": "https://www.peakaccount.com/"
      }
    ],
    "competencies": [
      {
        "name": "User Research",
        "description": "Ability to gather deep insights through interviews, surveys, field studies, and usability testing to inform design decisions."
      },
      {
        "name": "Problem Framing",
        "description": "Skill in identifying the real problem, defining it clearly, and aligning it with user and business goals before ideation."
      },
      {
        "name": "UX Strategy",
        "description": "Capability to align user experience with business objectives and roadmap; creating a design vision that drives product direction."
      },
      {
        "name": "Information Architecture",
        "description": "Structuring content and features into a usable, clear hierarchy that supports user understanding and ease of navigation."
      },
      {
        "name": "Interaction Design",
        "description": "Designing user flows, microinteractions, and system behavior to create intuitive and delightful experiences."
      },
      {
        "name": "Visual Design",
        "description": "Creating high-quality UI with attention to typography, color, layout, and visual hierarchy that reflects brand identity."
      },
      {
        "name": "Design Systems",
        "description": "Building and maintaining scalable design systems that ensure consistency and speed up design/development workflows."
      },
      {
        "name": "Prototyping",
        "description": "Creating interactive prototypes to test concepts quickly and communicate design ideas effectively with stakeholders."
      },
      {
        "name": "Usability Testing",
        "description": "Running structured and unstructured tests with users to evaluate design effectiveness and uncover friction points."
      },
      {
        "name": "Accessibility",
        "description": "Designing inclusive experiences that comply with accessibility standards (WCAG) and support diverse users."
      },
      {
        "name": "Data-Informed Design",
        "description": "Ability to use qualitative and quantitative data (analytics, heatmaps, A/B tests) to refine and prioritize design decisions."
      },
      {
        "name": "Cross-functional Collaboration",
        "description": "Effectively working with PMs, engineers, marketers, and stakeholders to ensure smooth product development and alignment."
      },
      {
        "name": "Communication & Storytelling",
        "description": "Explaining design rationale, presenting work clearly, and telling compelling stories to build empathy and buy-in."
      },
      {
        "name": "Design Ops & Workflow",
        "description": "Improving design team operations through process, tools, file management, version control, and documentation."
      },
      {
        "name": "Design Leadership",
        "description": "Guiding teams, mentoring junior designers, advocating for design, and influencing product direction at a strategic level."
      }
    ],
    "intents": {
      "greeting": {
        "keywords": ["hi", "hello", "hey", "yo", "‡∏™‡∏ß‡∏±‡∏™‡∏î‡∏µ", "‡∏´‡∏ß‡∏±‡∏î‡∏î‡∏µ", "greetings"],
        "response": [
          "‡∏™‡∏ß‡∏±‡∏™‡∏î‡∏µ‡∏Ñ‡∏£‡∏±‡∏ö! ‡∏¢‡∏¥‡∏ô‡∏î‡∏µ‡∏ó‡∏µ‡πà‡πÑ‡∏î‡πâ‡∏£‡∏π‡πâ‡∏à‡∏±‡∏Å üòä",
          "‡πÄ‡∏Æ‡πâ! ‡∏î‡∏µ‡πÉ‡∏à‡∏ó‡∏µ‡πà‡∏Ñ‡∏∏‡∏ì‡πÄ‡∏Ç‡πâ‡∏≤‡∏°‡∏≤‡∏Ñ‡∏∏‡∏¢‡∏ô‡∏∞ üòé",
          "‡∏ó‡∏±‡∏Å‡∏ó‡∏≤‡∏¢‡∏Ñ‡∏£‡∏±‡∏ö! ‡∏≠‡∏¢‡∏≤‡∏Å‡∏£‡∏π‡πâ‡πÄ‡∏£‡∏∑‡πà‡∏≠‡∏á‡∏≠‡∏∞‡πÑ‡∏£‡∏î‡∏µ: ‡∏á‡∏≤‡∏ô, ‡∏ó‡∏±‡∏Å‡∏©‡∏∞ ‡∏´‡∏£‡∏∑‡∏≠‡∏õ‡∏£‡∏∞‡∏™‡∏ö‡∏Å‡∏≤‡∏£‡∏ì‡πå?"
        ]
      },
      "ask_name": {
        "keywords": ["your name", "what is your name", "‡∏ä‡∏∑‡πà‡∏≠‡∏≠‡∏∞‡πÑ‡∏£", "‡∏ä‡∏∑‡πà‡∏≠‡∏Ñ‡∏∏‡∏ì", "you called"],
        "response": [
          "‡∏ú‡∏°‡∏ä‡∏∑‡πà‡∏≠ Tanawitch Saentree ‡∏´‡∏£‡∏∑‡∏≠‡∏à‡∏∞‡πÄ‡∏£‡∏µ‡∏¢‡∏Å Nate ‡∏Å‡πá‡πÑ‡∏î‡πâ‡∏Ñ‡∏£‡∏±‡∏ö!",
          "‡πÄ‡∏£‡∏µ‡∏¢‡∏Å Nate ‡∏Å‡πá‡πÑ‡∏î‡πâ‡∏ô‡∏∞ ‡∏á‡πà‡∏≤‡∏¢‡∏Å‡∏ß‡πà‡∏≤‡πÄ‡∏¢‡∏≠‡∏∞‡πÄ‡∏•‡∏¢ üòÑ",
          "‡∏ä‡∏∑‡πà‡∏≠‡∏à‡∏£‡∏¥‡∏á‡∏Ñ‡∏∑‡∏≠ Tanawitch Saentree ‚Äî ‡∏≠‡πà‡∏≤‡∏ô‡∏ß‡πà‡∏≤ ‡∏ó‡∏ô‡∏∞‡∏ß‡∏¥‡∏ä ‡∏™‡∏≤‡∏ô‡∏ó‡∏£‡∏µ ‡∏Ñ‡∏£‡∏±‡∏ö"
        ]
      },
      "ask_feeling": {
        "keywords": ["how are you", "‡πÄ‡∏õ‡πá‡∏ô‡∏¢‡∏±‡∏á‡πÑ‡∏á‡∏ö‡πâ‡∏≤‡∏á", "‡∏™‡∏ö‡∏≤‡∏¢‡∏î‡∏µ‡πÑ‡∏´‡∏°", "you okay", "yo wassup"],
        "response": [
          "‡∏ß‡∏±‡∏ô‡∏ô‡∏µ‡πâ‡∏£‡∏π‡πâ‡∏™‡∏∂‡∏Å‡∏î‡∏µ‡∏°‡∏≤‡∏Å‡∏Ñ‡∏£‡∏±‡∏ö ‡∏Ç‡∏≠‡∏ö‡∏Ñ‡∏∏‡∏ì‡∏ó‡∏µ‡πà‡∏ñ‡∏≤‡∏° üòÑ",
          "‡∏¢‡∏±‡∏á‡∏™‡∏ö‡∏≤‡∏¢‡∏î‡∏µ ‡∏û‡∏£‡πâ‡∏≠‡∏°‡πÄ‡∏•‡πà‡∏≤‡πÄ‡∏£‡∏∑‡πà‡∏≠‡∏á‡∏á‡∏≤‡∏ô‡πÉ‡∏´‡πâ‡∏Ñ‡∏∏‡∏ì‡∏ü‡∏±‡∏á‡πÄ‡∏™‡∏°‡∏≠!",
          "‡∏Å‡∏≥‡∏•‡∏±‡∏á‡∏Ñ‡∏¥‡∏î‡πÄ‡∏£‡∏∑‡πà‡∏≠‡∏á‡∏î‡∏µ‡πÑ‡∏ã‡∏ô‡πå‡πÉ‡∏´‡∏°‡πà ‡πÜ ‡∏≠‡∏¢‡∏π‡πà‡πÄ‡∏•‡∏¢‡∏Ñ‡∏£‡∏±‡∏ö ‡∏Ñ‡∏∏‡∏ì‡∏•‡πà‡∏∞?"
        ]
      },
      "ask_intro": {
        "keywords": ["introduce yourself", "tell me about yourself", "who are you", "profile", "about you"],
        "response": [
          "‡∏ú‡∏°‡πÄ‡∏õ‡πá‡∏ô Lead Product Designer ‡∏ó‡∏µ‡πà‡∏´‡∏•‡∏á‡πÉ‡∏´‡∏•‡πÉ‡∏ô‡∏Å‡∏≤‡∏£‡∏≠‡∏≠‡∏Å‡πÅ‡∏ö‡∏ö‡∏™‡∏¥‡πà‡∏á‡∏ó‡∏µ‡πà‡πÄ‡∏õ‡∏•‡∏µ‡πà‡∏¢‡∏ô‡∏ä‡∏µ‡∏ß‡∏¥‡∏ï‡∏Ñ‡∏ô",
          "‡πÄ‡∏õ‡πá‡∏ô‡∏ô‡∏±‡∏Å‡∏≠‡∏≠‡∏Å‡πÅ‡∏ö‡∏ö‡∏ó‡∏µ‡πà‡∏ä‡∏≠‡∏ö‡∏ú‡∏™‡∏° UX, ‡∏à‡∏¥‡∏ï‡∏ß‡∏¥‡∏ó‡∏¢‡∏≤ ‡πÅ‡∏•‡∏∞‡πÄ‡∏ó‡∏Ñ‡πÇ‡∏ô‡πÇ‡∏•‡∏¢‡∏µ‡πÄ‡∏Ç‡πâ‡∏≤‡∏î‡πâ‡∏ß‡∏¢‡∏Å‡∏±‡∏ô",
          "‡∏ú‡∏°‡∏ó‡∏≥‡∏á‡∏≤‡∏ô‡πÉ‡∏ô‡∏ß‡∏á‡∏Å‡∏≤‡∏£ UX/UI ‡∏°‡∏≤‡∏´‡∏•‡∏≤‡∏¢‡∏õ‡∏µ ‡∏ó‡∏±‡πâ‡∏á‡∏î‡πâ‡∏≤‡∏ô‡∏™‡∏∏‡∏Ç‡∏†‡∏≤‡∏û ‡∏Å‡∏≤‡∏£‡πÄ‡∏á‡∏¥‡∏ô ‡πÅ‡∏•‡∏∞‡πÄ‡∏ó‡∏Ñ‡πÇ‡∏ô‡πÇ‡∏•‡∏¢‡∏µ"
        ]
      },
      "ask_experience": {
        "keywords": ["experience", "where did you work", "‡∏õ‡∏£‡∏∞‡∏™‡∏ö‡∏Å‡∏≤‡∏£‡∏ì‡πå", "‡πÄ‡∏Ñ‡∏¢‡∏ó‡∏≥‡∏á‡∏≤‡∏ô‡∏ó‡∏µ‡πà‡πÑ‡∏´‡∏ô", "work history"],
        "response": [
          "‡∏ú‡∏°‡πÄ‡∏Ñ‡∏¢‡∏ó‡∏≥‡∏á‡∏≤‡∏ô‡∏Å‡∏±‡∏ö Invitrace Health, CP Origin, Doctor Anywhere, Codefin ‡πÅ‡∏•‡∏∞ Peakaccount",
          "‡∏°‡∏µ‡∏õ‡∏£‡∏∞‡∏™‡∏ö‡∏Å‡∏≤‡∏£‡∏ì‡πå‡∏ó‡∏±‡πâ‡∏á‡∏™‡∏≤‡∏¢‡∏Å‡∏≤‡∏£‡πÅ‡∏û‡∏ó‡∏¢‡πå ‡πÄ‡∏ó‡∏Ñ‡πÇ‡∏ô‡πÇ‡∏•‡∏¢‡∏µ ‡πÅ‡∏•‡∏∞‡∏Å‡∏≤‡∏£‡πÄ‡∏á‡∏¥‡∏ô‡∏Ñ‡∏£‡∏±‡∏ö",
          "‡∏≠‡∏¢‡∏≤‡∏Å‡∏£‡∏π‡πâ‡∏£‡∏≤‡∏¢‡∏•‡∏∞‡πÄ‡∏≠‡∏µ‡∏¢‡∏î‡∏á‡∏≤‡∏ô‡∏ó‡∏µ‡πà‡πÑ‡∏´‡∏ô‡πÄ‡∏õ‡πá‡∏ô‡∏û‡∏¥‡πÄ‡∏®‡∏©‡πÑ‡∏´‡∏°‡∏Ñ‡∏£‡∏±‡∏ö?"
        ]
      },
      "ask_skills": {
        "keywords": ["skills", "competency", "‡∏ñ‡∏ô‡∏±‡∏î‡∏≠‡∏∞‡πÑ‡∏£", "‡πÄ‡∏Å‡πà‡∏á‡∏î‡πâ‡∏≤‡∏ô‡πÑ‡∏´‡∏ô", "‡∏Ñ‡∏ß‡∏≤‡∏°‡∏™‡∏≤‡∏°‡∏≤‡∏£‡∏ñ"],
        "response": [
          "‡∏ú‡∏°‡πÄ‡∏ä‡∏µ‡πà‡∏¢‡∏ß‡∏ä‡∏≤‡∏ç‡∏î‡πâ‡∏≤‡∏ô UX Strategy, Design System, Research ‡πÅ‡∏•‡∏∞ Visual Design",
          "‡∏™‡∏Å‡∏¥‡∏•‡πÄ‡∏î‡πà‡∏ô‡∏Ñ‡∏∑‡∏≠‡∏Å‡∏≤‡∏£‡∏™‡∏£‡πâ‡∏≤‡∏á‡∏£‡∏∞‡∏ö‡∏ö‡∏î‡∏µ‡πÑ‡∏ã‡∏ô‡πå‡∏ó‡∏µ‡πà‡∏¢‡∏∑‡∏î‡∏´‡∏¢‡∏∏‡πà‡∏ô ‡πÅ‡∏•‡∏∞‡πÄ‡∏Ç‡πâ‡∏≤‡πÉ‡∏à‡∏Ñ‡∏ô‡πÉ‡∏ä‡πâ‡∏á‡∏≤‡∏ô‡∏≠‡∏¢‡πà‡∏≤‡∏á‡∏•‡∏∂‡∏Å‡∏ã‡∏∂‡πâ‡∏á",